Variable / Field Name,Section Header,Field Type,Field Label,"Choices, Calculations, OR Slider Labels",Field Note,Text Validation Type OR Show Slider Number,Text Validation Min,Text Validation Max,Branching Logic (Show field only if...),Unit,CDE Reference
protocol_id,PCR metadata,text,Unique protocol id used in data files to refer to PCR metadata,,example: 2019-nCoV_N1,,,,,,RADx-rad DCC
pcr_type,PCR metadata,category,Type of PCR method,LAMP | V2G-qPCR | rt-qPCR | qPCR | ddPCR,,,,,,,RADx-rad DCC|http://purl.bioontology.org/ontology/LNC/LA26418-6
pcr_multipexed,PCR metadata,category,If PCR was multiplexed,Yes | No,,,,,,,RADx-rad DCC|http://www.bioassayontology.org/bao#BAO_0000564
pcr_nucleic_acid_type,PCR metadata,category,type of nucleic acid targeted in the assay,RNA | DNA,,,,,,,RADx-rad DCC
pcr_target_organism_name,PCR metadata,text,NCBI organism name,,example: SARS-CoV-2,,,,,,RADx-rad DCC|https://www.ncbi.nlm.nih.gov/taxonomy
pcr_target_organims_taxonomy_id,PCR metadata,integer,NCBI taxonomy id for organism,,example: 2697049,,,,,,RADx-rad DCC|https://www.ncbi.nlm.nih.gov/taxonomy
pcr_target_organism_subtype,PCR metadata,text,subtype of organism,,example: H1N1 (for influenza),,,,,,RADx-rad DCC
pcr_target_refseq,PCR metadata,text,GenBank reference sequence id,,example: MN985325.1,,,,,,RADx-rad DCC
pcr_target_gisaid_id,PCR metadata,text,GISAID id reference sequence id,,example: EPI_ISL_402124,,,,,,RADx-rad DCC
pcr_target_organism_pango_lineage,PCR metadata,text,Pango lineage for SARS-CoV-2 variants,,example: B.1.1.7,,,,,,RADx-rad DCC|https://cov-lineages.org/
pcr_target_organism_who_label,PCR metadata,text,WHO label for SARS-CoV-2 variants,,example: Alpha,,,,,,RADx-rad DCC|https://www.who.int/en/activities/tracking-SARS-CoV-2-variants/
pcr_target_organism_gisaid_clade,PCR metadata,text,GISAID clade for SARS-CoV-2 variants,,example: GRY,,,,,,RADx-rad DCC
pcr_target_gene_name,PCR metadata,text,NCBI or UniProt gene name,,example: S,,,,,,RADx-rad DCC|http://edamontology.org/data_2299
pcr_target_gene_id,PCR metadata,text,unique identifier for the gene,,example: a gene Ensemble ID,,,,,,RADx-rad DCC|http://edamontology.org/data_2295
pcr_target_gene_region,PCR metadata,text,domain or subunit name,,e.g. receptor binding domain,,,,,,RADx-rad DCC
pcr_target_chromosome,PCR metadata,text,chromosome number,,"e.g. 1-22, X, Y for human",,,,,,RADx-rad DCC|http://edamontology.org/data_0987
forward_primer_id,PCR metadata,text,"unique identifier such as name, id, product name, or catalog number",,example: 2019-nCoV_N1-F,,,,,,RADx-rad DCC|http://purl.obolibrary.org/obo/OBI_0001946
forward_primer_sequence,PCR metadata,sequence,5' to 3' sequence of primer,,example: 5'-GACCCCAAAATCAGCGAAAT-3',,,,,,RADx-rad DCC|http://purl.obolibrary.org/obo/OBI_0001946
forward_primer_strand,PCR metadata,category,primer strand,Positive | Negative,,,,,,,RADx-rad DCC|http://purl.obolibrary.org/obo/OBI_0001946
forward_primer_genome_start,PCR metadata,integer,starting position (1-based) of the primer in the genome reference sequence,,example: 28287,,,,,,RADx-rad DCC|http://purl.obolibrary.org/obo/OBI_0001946
forward_primer_genome_end,PCR metadata,integer,ending position (1-based) of the primer in the reference genome sequence,,example: 28306,,,,,,RADx-rad DCC|http://purl.obolibrary.org/obo/OBI_0001946
reverse_primer_id,PCR metadata,text,"unique identifier such as name, id, product name, or catalog number",,example: 2019-nCoV_N1-R,,,,,,RADx-rad DCC|http://purl.obolibrary.org/obo/OBI_0001951
reverse_primer_sequence,PCR metadata,sequence,5' to 3' sequence of primer,,example: 5'-TCTGGTTACTGCCAGTTGAATCTG-3',,,,,,RADx-rad DCC|http://purl.obolibrary.org/obo/OBI_0001951
reverse_primer_strand,PCR metadata,category,primer strand,Positive | Negative,,,,,,,RADx-rad DCC|http://purl.obolibrary.org/obo/OBI_0001951
reverse_primer_genome_start,PCR metadata,integer,starting position (1-based) of the primer in the genome reference sequence,,example: 28335,,,,,,RADx-rad DCC|http://purl.obolibrary.org/obo/OBI_0001951
reverse_primer_genome_end,PCR metadata,integer,ending position (1-based) of the primer in the reference genome sequence,,example: 28358,,,,,,RADx-rad DCC|http://purl.obolibrary.org/obo/OBI_0001951
primer_source,PCR metadata,text,"supplier name,  instrument for synthesis, or literature reference",,,,,,,,RADx-rad DCC|http://purl.obolibrary.org/obo/OBI_0000405
primer_lot_number,PCR metadata,text,lot number for primer,,,,,,,,RADx-rad DCC|http://purl.obolibrary.org/obo/OBI_0000405
primer_source_url,PCR metadata,url,"URL that links to vendors catalog page for this primer or pcr kit, or link to paper",,,,,,,,RADx-rad DCC|http://purl.obolibrary.org/obo/OBI_0000405
probe_id,PCR metadata,text,"unique identifier such as name, id, product name, or catalog number",,example: 2019-nCoV_N1-P,,,,,,RADx-rad DCC
probe_source,PCR metadata,text,"suppler name,  instrument for synthesis, or literature reference",,,,,,,,RADx-rad DCC
probe_source_url,PCR metadata,url,URL that links to vendors catalog page for this probe or pcr kit,,,,,,,,RADx-rad DCC
probe_lot_number, PCR metadata,text,lot number for probe,,,,,,,,RADx-rad DCC
probe_sequence,PCR metadata,sequence,"5' to 3' sequence of probe with modifications separated by ""-""",,example: FAM-5'-ACCCCGCATTACGTTTGGTGGACC-3'-BHQ1,,,,,,RADx-rad DCC
probe_genome_start,PCR metadata,integer,starting position (1-based) of the probe in the genome reference sequence,,example: 28309,,,,,,RADx-rad DCC
probe_genome_end,PCR metadata,integer,ending position (1-based) of the primer in the reference genome sequence,,example: 28332,,,,,,RADx-rad DCC
probe_reporter,PCR metadata,text,name of the 5' fluorescent probe,,example: FAM,,,,,,RADx-rad DCC
probe_quencher_internal,PCR metadata,text,name of internal quencher,,example: ZEN,,,,,,RADx-rad DCC
probe_quencher,PCR metadata,text,name of 3' quencher,,example: BHQ1,,,,,,RADx-rad DCC
probe_minor_groove_binder,PCR metadata,text,name of the 3' minor groove binder,,example: MGB,,,,,,RADx-rad DCC
pcr_run_id,PCR,text,unique identifier for the PCR run,,,,,,,,RADx-rad DCC
pcr_instrument,PCR,text,maker and model of PCR instrument used for the assay,,,,,,,,RADx-rad DCC
pcr_cycle_threshold,PCR,float,calculated Cq value based on threshold and standards,,,,,,,,RADx-rad DCC|http://purl.obolibrary.org/obo/STATO_0000190
pcr_count,PCR,integer,calculated count value based on threshold and standards,,,,,,,,RADx-rad DCC
pcr_concentration,PCR,float,calculated copies per microliter of reaction for dPCR,,,,,,,copies/uL,RADx-rad DCC
pcr_indication,PCR,category,indication of positive or negative result for the target,Positive | Negative,,,,,,,RADx-rad DCC
pcr_standard_type,PCR,text,"indication of whether the well acts as a standard. If so, which type.",NTC | Count Standard | Negative,,,,,,,RADx-rad DCC
pcr_standard_count,PCR,integer,"if well is a count standard, known count value",,,,,,,,RADx-rad DCC
assay_date,PCR,date,date of assay performed,,example: 2021-01-01,,,,,,RADx-rad DCC
well_id,PCR,text,well location,,example: A1,,,,,,RADx-rad DCC
notes,PCR,text,notes about this sample or assay,,,,,,,,RADx-rad DCC